{
  "schemaVersion": "1.0.0",
  "id": "batteries-dna-fusion",
  "name": "Batteries DNA Unified Fusion",
  "version": "0.1.0",
  "status": "DRAFT_REVIEW",
  "loadMode": "metadata_preload",
  "registryId": "BATTERIES_DNA_ASMA_99",
  "description": "Preloads all 99 first-party DNA package manifests into the main API process as metadata. It does not execute proposed capabilities or grant authority.",
  "executionEnabled": false,
  "authorityGranted": false,
  "components": [
    {
      "id": "dna-rahman",
      "packageName": "@empire/batteries-dna-rahman",
      "recordType": "bounded_project_mapping",
      "required": true
    },
    {
      "id": "dna-rahim",
      "packageName": "@empire/batteries-dna-rahim",
      "recordType": "bounded_project_mapping",
      "required": true
    },
    {
      "id": "dna-malik",
      "packageName": "@empire/batteries-dna-malik",
      "recordType": "bounded_project_mapping",
      "required": true
    },
    {
      "id": "dna-quddus",
      "packageName": "@empire/batteries-dna-quddus",
      "recordType": "bounded_project_mapping",
      "required": true
    },
    {
      "id": "dna-salam",
      "packageName": "@empire/batteries-dna-salam",
      "recordType": "bounded_project_mapping",
      "required": true
    },
    {
      "id": "dna-mumin",
      "packageName": "@empire/batteries-dna-mumin",
      "recordType": "bounded_project_mapping",
      "required": true
    },
    {
      "id": "dna-muhaymin",
      "packageName": "@empire/batteries-dna-muhaymin",
      "recordType": "bounded_project_mapping",
      "required": true
    },
    {
      "id": "dna-aziz",
      "packageName": "@empire/batteries-dna-aziz",
      "recordType": "bounded_project_mapping",
      "required": true
    },
    {
      "id": "dna-jabbar",
      "packageName": "@empire/batteries-dna-jabbar",
      "recordType": "bounded_project_mapping",
      "required": true
    },
    {
      "id": "dna-mutakabbir",
      "packageName": "@empire/batteries-dna-mutakabbir",
      "recordType": "reference_only",
      "required": true
    },
    {
      "id": "dna-khaliq",
      "packageName": "@empire/batteries-dna-khaliq",
      "recordType": "bounded_project_mapping",
      "required": true
    },
    {
      "id": "dna-bari",
      "packageName": "@empire/batteries-dna-bari",
      "recordType": "bounded_project_mapping",
      "required": true
    },
    {
      "id": "dna-musawwir",
      "packageName": "@empire/batteries-dna-musawwir",
      "recordType": "bounded_project_mapping",
      "required": true
    },
    {
      "id": "dna-ghaffar",
      "packageName": "@empire/batteries-dna-ghaffar",
      "recordType": "bounded_project_mapping",
      "required": true
    },
    {
      "id": "dna-qahhar",
      "packageName": "@empire/batteries-dna-qahhar",
      "recordType": "bounded_project_mapping",
      "required": true
    },
    {
      "id": "dna-wahhab",
      "packageName": "@empire/batteries-dna-wahhab",
      "recordType": "bounded_project_mapping",
      "required": true
    },
    {
      "id": "dna-razzaq",
      "packageName": "@empire/batteries-dna-razzaq",
      "recordType": "bounded_project_mapping",
      "required": true
    },
    {
      "id": "dna-fattah",
      "packageName": "@empire/batteries-dna-fattah",
      "recordType": "bounded_project_mapping",
      "required": true
    },
    {
      "id": "dna-alim",
      "packageName": "@empire/batteries-dna-alim",
      "recordType": "bounded_project_mapping",
      "required": true
    },
    {
      "id": "dna-qabidh",
      "packageName": "@empire/batteries-dna-qabidh",
      "recordType": "bounded_project_mapping",
      "required": true
    },
    {
      "id": "dna-basith",
      "packageName": "@empire/batteries-dna-basith",
      "recordType": "bounded_project_mapping",
      "required": true
    },
    {
      "id": "dna-khafid",
      "packageName": "@empire/batteries-dna-khafid",
      "recordType": "bounded_project_mapping",
      "required": true
    },
    {
      "id": "dna-rafi",
      "packageName": "@empire/batteries-dna-rafi",
      "recordType": "bounded_project_mapping",
      "required": true
    },
    {
      "id": "dna-muizz",
      "packageName": "@empire/batteries-dna-muizz",
      "recordType": "bounded_project_mapping",
      "required": true
    },
    {
      "id": "dna-mudhill",
      "packageName": "@empire/batteries-dna-mudhill",
      "recordType": "bounded_project_mapping",
      "required": true
    },
    {
      "id": "dna-sami",
      "packageName": "@empire/batteries-dna-sami",
      "recordType": "bounded_project_mapping",
      "required": true
    },
    {
      "id": "dna-basir",
      "packageName": "@empire/batteries-dna-basir",
      "recordType": "bounded_project_mapping",
      "required": true
    },
    {
      "id": "dna-hakam",
      "packageName": "@empire/batteries-dna-hakam",
      "recordType": "bounded_project_mapping",
      "required": true
    },
    {
      "id": "dna-adl",
      "packageName": "@empire/batteries-dna-adl",
      "recordType": "bounded_project_mapping",
      "required": true
    },
    {
      "id": "dna-latif",
      "packageName": "@empire/batteries-dna-latif",
      "recordType": "bounded_project_mapping",
      "required": true
    },
    {
      "id": "dna-khabir",
      "packageName": "@empire/batteries-dna-khabir",
      "recordType": "bounded_project_mapping",
      "required": true
    },
    {
      "id": "dna-halim",
      "packageName": "@empire/batteries-dna-halim",
      "recordType": "bounded_project_mapping",
      "required": true
    },
    {
      "id": "dna-azim",
      "packageName": "@empire/batteries-dna-azim",
      "recordType": "bounded_project_mapping",
      "required": true
    },
    {
      "id": "dna-ghafur",
      "packageName": "@empire/batteries-dna-ghafur",
      "recordType": "bounded_project_mapping",
      "required": true
    },
    {
      "id": "dna-shakur",
      "packageName": "@empire/batteries-dna-shakur",
      "recordType": "bounded_project_mapping",
      "required": true
    },
    {
      "id": "dna-aliyy",
      "packageName": "@empire/batteries-dna-aliyy",
      "recordType": "reference_only",
      "required": true
    },
    {
      "id": "dna-kabir",
      "packageName": "@empire/batteries-dna-kabir",
      "recordType": "bounded_project_mapping",
      "required": true
    },
    {
      "id": "dna-hafiz",
      "packageName": "@empire/batteries-dna-hafiz",
      "recordType": "bounded_project_mapping",
      "required": true
    },
    {
      "id": "dna-muqit",
      "packageName": "@empire/batteries-dna-muqit",
      "recordType": "bounded_project_mapping",
      "required": true
    },
    {
      "id": "dna-hasib",
      "packageName": "@empire/batteries-dna-hasib",
      "recordType": "bounded_project_mapping",
      "required": true
    },
    {
      "id": "dna-jalil",
      "packageName": "@empire/batteries-dna-jalil",
      "recordType": "bounded_project_mapping",
      "required": true
    },
    {
      "id": "dna-karim",
      "packageName": "@empire/batteries-dna-karim",
      "recordType": "bounded_project_mapping",
      "required": true
    },
    {
      "id": "dna-raqib",
      "packageName": "@empire/batteries-dna-raqib",
      "recordType": "bounded_project_mapping",
      "required": true
    },
    {
      "id": "dna-mujib",
      "packageName": "@empire/batteries-dna-mujib",
      "recordType": "bounded_project_mapping",
      "required": true
    },
    {
      "id": "dna-wasi",
      "packageName": "@empire/batteries-dna-wasi",
      "recordType": "bounded_project_mapping",
      "required": true
    },
    {
      "id": "dna-hakim",
      "packageName": "@empire/batteries-dna-hakim",
      "recordType": "bounded_project_mapping",
      "required": true
    },
    {
      "id": "dna-wadud",
      "packageName": "@empire/batteries-dna-wadud",
      "recordType": "bounded_project_mapping",
      "required": true
    },
    {
      "id": "dna-majid",
      "packageName": "@empire/batteries-dna-majid",
      "recordType": "reference_only",
      "required": true
    },
    {
      "id": "dna-baith",
      "packageName": "@empire/batteries-dna-baith",
      "recordType": "bounded_project_mapping",
      "required": true
    },
    {
      "id": "dna-shahid",
      "packageName": "@empire/batteries-dna-shahid",
      "recordType": "bounded_project_mapping",
      "required": true
    },
    {
      "id": "dna-haqq",
      "packageName": "@empire/batteries-dna-haqq",
      "recordType": "bounded_project_mapping",
      "required": true
    },
    {
      "id": "dna-wakil",
      "packageName": "@empire/batteries-dna-wakil",
      "recordType": "bounded_project_mapping",
      "required": true
    },
    {
      "id": "dna-qawiyy",
      "packageName": "@empire/batteries-dna-qawiyy",
      "recordType": "bounded_project_mapping",
      "required": true
    },
    {
      "id": "dna-matin",
      "packageName": "@empire/batteries-dna-matin",
      "recordType": "bounded_project_mapping",
      "required": true
    },
    {
      "id": "dna-waliyy",
      "packageName": "@empire/batteries-dna-waliyy",
      "recordType": "bounded_project_mapping",
      "required": true
    },
    {
      "id": "dna-hamid",
      "packageName": "@empire/batteries-dna-hamid",
      "recordType": "bounded_project_mapping",
      "required": true
    },
    {
      "id": "dna-muhsi",
      "packageName": "@empire/batteries-dna-muhsi",
      "recordType": "bounded_project_mapping",
      "required": true
    },
    {
      "id": "dna-mubdi",
      "packageName": "@empire/batteries-dna-mubdi",
      "recordType": "bounded_project_mapping",
      "required": true
    },
    {
      "id": "dna-muid",
      "packageName": "@empire/batteries-dna-muid",
      "recordType": "bounded_project_mapping",
      "required": true
    },
    {
      "id": "dna-muhyi",